{
  "topic": "Математика",
  "title": "Линейные уравнения",
  "difficulty": 2,
  "tags": ["уравнения", "алгебра"],
  "intro_text": "## Линейные уравнения — краткая теория\n\nЛинейное уравнение — это уравнение вида **ax + b = c**, где x — неизвестное.\n\n### Главное правило\n> Что делаешь с одной стороной уравнения — делай то же самое с другой.\n\n### Алгоритм решения\n1. **Перенеси числа** без x на правую сторону (меняй знак при переносе).\n2. **Перенеси слагаемые с x** на левую сторону.\n3. **Раздели** обе части на коэффициент при x.\n4. **Проверь** — подставь ответ в исходное уравнение.\n\n### Примеры\n```\n2x + 5 = 13\n2x = 13 − 5       ← переносим 5 вправо, меняем знак\n2x = 8\nx = 8 ÷ 2 = 4     ← делим на коэффициент\n```\n\n```\n5x − 3 = 2x + 9\n5x − 2x = 9 + 3   ← x-члены влево, числа вправо\n3x = 12\nx = 4\n```\n\n### Уравнение со скобками\n```\n3(x + 2) = 18\n3x + 6 = 18       ← раскрываем скобку\n3x = 12\nx = 4\n```\n\n> **Запомни:** перенос слагаемого = смена знака. Перенос множителя = деление.",
  "questions": [
    {
      "id": 1,
      "text": "Реши уравнение: x + 7 = 15",
      "options": {
        "A": "x = 7",
        "B": "x = 8",
        "C": "x = 22",
        "D": "x = 6"
      },
      "correct": "B",
      "explanation": "Переносим 7 вправо, меняя знак: x = 15 − 7 = 8. Проверка: 8 + 7 = 15 ✓",
      "tags": ["уравнения"],
      "difficulty": 1
    },
    {
      "id": 2,
      "text": "Реши уравнение: 3x = 21",
      "options": {
        "A": "x = 7",
        "B": "x = 18",
        "C": "x = 63",
        "D": "x = 24"
      },
      "correct": "A",
      "explanation": "Делим обе части на 3: x = 21 ÷ 3 = 7. Проверка: 3 × 7 = 21 ✓",
      "tags": ["уравнения"],
      "difficulty": 1
    },
    {
      "id": 3,
      "text": "Реши уравнение: x − 4 = 9",
      "options": {
        "A": "x = 5",
        "B": "x = 36",
        "C": "x = 13",
        "D": "x = 4"
      },
      "correct": "C",
      "explanation": "Переносим −4 вправо, знак меняется: x = 9 + 4 = 13. Проверка: 13 − 4 = 9 ✓",
      "tags": ["уравнения"],
      "difficulty": 1
    },
    {
      "id": 4,
      "text": "Реши уравнение: 2x + 3 = 11",
      "options": {
        "A": "x = 7",
        "B": "x = 3",
        "C": "x = 5",
        "D": "x = 4"
      },
      "correct": "D",
      "explanation": "2x = 11 − 3 = 8, затем x = 8 ÷ 2 = 4. Проверка: 2×4 + 3 = 11 ✓",
      "tags": ["уравнения"],
      "difficulty": 1
    },
    {
      "id": 5,
      "text": "Реши уравнение: 4x − 5 = 15",
      "options": {
        "A": "x = 2,5",
        "B": "x = 5",
        "C": "x = 6",
        "D": "x = 4"
      },
      "correct": "B",
      "explanation": "4x = 15 + 5 = 20, затем x = 20 ÷ 4 = 5. Проверка: 4×5 − 5 = 15 ✓",
      "tags": ["уравнения"],
      "difficulty": 1
    },
    {
      "id": 6,
      "text": "Реши уравнение: x ÷ 5 = 4",
      "options": {
        "A": "x = 0,8",
        "B": "x = 9",
        "C": "x = 20",
        "D": "x = 1"
      },
      "correct": "C",
      "explanation": "Умножаем обе части на 5: x = 4 × 5 = 20. Проверка: 20 ÷ 5 = 4 ✓",
      "tags": ["уравнения"],
      "difficulty": 1
    },
    {
      "id": 7,
      "text": "Реши уравнение: 5x + 2 = 3x + 10",
      "options": {
        "A": "x = 4",
        "B": "x = 3",
        "C": "x = 6",
        "D": "x = 2"
      },
      "correct": "A",
      "explanation": "Переносим 3x влево, 2 вправо: 5x − 3x = 10 − 2 → 2x = 8 → x = 4. Проверка: 5×4+2 = 22 = 3×4+10 ✓",
      "tags": ["уравнения", "алгебра"],
      "difficulty": 2
    },
    {
      "id": 8,
      "text": "Реши уравнение: 6(x − 1) = 18",
      "options": {
        "A": "x = 2",
        "B": "x = 5",
        "C": "x = 3",
        "D": "x = 4"
      },
      "correct": "D",
      "explanation": "Делим обе части на 6: x − 1 = 3, затем x = 3 + 1 = 4. Проверка: 6×(4−1) = 6×3 = 18 ✓",
      "tags": ["уравнения", "скобки"],
      "difficulty": 2
    },
    {
      "id": 9,
      "text": "Реши уравнение: 2x ÷ 3 = 8",
      "options": {
        "A": "x = 16",
        "B": "x = 12",
        "C": "x = 4",
        "D": "x = 6"
      },
      "correct": "B",
      "explanation": "Умножаем обе части на 3: 2x = 24, затем делим на 2: x = 12. Проверка: 2×12÷3 = 8 ✓",
      "tags": ["уравнения", "дроби"],
      "difficulty": 2
    },
    {
      "id": 10,
      "text": "Реши уравнение: 7x − 2x = 25",
      "options": {
        "A": "x = 5",
        "B": "x = 7",
        "C": "x = 4",
        "D": "x = 6"
      },
      "correct": "A",
      "explanation": "Приводим подобные: 7x − 2x = 5x = 25, затем x = 25 ÷ 5 = 5. Проверка: 7×5 − 2×5 = 25 ✓",
      "tags": ["уравнения", "алгебра"],
      "difficulty": 2
    },
    {
      "id": 11,
      "text": "Реши уравнение: 3(2x + 1) = 21",
      "options": {
        "A": "x = 2",
        "B": "x = 4",
        "C": "x = 3",
        "D": "x = 5"
      },
      "correct": "C",
      "explanation": "Раскрываем скобку: 6x + 3 = 21 → 6x = 18 → x = 3. Проверка: 3×(6+1) = 3×7 = 21 ✓",
      "tags": ["уравнения", "скобки"],
      "difficulty": 2
    },
    {
      "id": 12,
      "text": "Реши уравнение: x + 3x = 28",
      "options": {
        "A": "x = 8",
        "B": "x = 4",
        "C": "x = 9",
        "D": "x = 7"
      },
      "correct": "D",
      "explanation": "Приводим подобные: 4x = 28 → x = 7. Проверка: 7 + 3×7 = 7 + 21 = 28 ✓",
      "tags": ["уравнения"],
      "difficulty": 1
    },
    {
      "id": 13,
      "text": "Реши уравнение: 9 − x = 4",
      "options": {
        "A": "x = 13",
        "B": "x = 5",
        "C": "x = 36",
        "D": "x = 4"
      },
      "correct": "B",
      "explanation": "Переносим x вправо, 4 влево: 9 − 4 = x → x = 5. Проверка: 9 − 5 = 4 ✓",
      "tags": ["уравнения"],
      "difficulty": 1
    },
    {
      "id": 14,
      "text": "Реши уравнение: 2(x + 4) = 14",
      "options": {
        "A": "x = 3",
        "B": "x = 5",
        "C": "x = 9",
        "D": "x = 7"
      },
      "correct": "A",
      "explanation": "Раскрываем: 2x + 8 = 14 → 2x = 6 → x = 3. Проверка: 2×(3+4) = 2×7 = 14 ✓",
      "tags": ["уравнения", "скобки"],
      "difficulty": 2
    },
    {
      "id": 15,
      "text": "Задача: Число, умноженное на 4 и уменьшенное на 6, равно 18. Найди это число.",
      "options": {
        "A": "x = 3",
        "B": "x = 4",
        "C": "x = 6",
        "D": "x = 8"
      },
      "correct": "C",
      "explanation": "Составляем уравнение: 4x − 6 = 18 → 4x = 24 → x = 6. Проверка: 4×6 − 6 = 18 ✓",
      "tags": ["уравнения", "текстовые-задачи"],
      "difficulty": 3
    },
    {
      "id": 16,
      "text": "Реши уравнение: 10 − 3x = 1",
      "options": {
        "A": "x = 11/3",
        "B": "x = 4",
        "C": "x = 1",
        "D": "x = 3"
      },
      "correct": "D",
      "explanation": "Переносим 3x вправо, 1 влево: 10 − 1 = 3x → 9 = 3x → x = 3. Проверка: 10 − 9 = 1 ✓",
      "tags": ["уравнения"],
      "difficulty": 2
    },
    {
      "id": 17,
      "text": "Задача: У Айбека было x яблок. Он отдал 5, потом получил 3. Теперь у него 12. Сколько яблок было у Айбека?",
      "options": {
        "A": "x = 10",
        "B": "x = 14",
        "C": "x = 20",
        "D": "x = 9"
      },
      "correct": "B",
      "explanation": "Составляем уравнение: x − 5 + 3 = 12 → x − 2 = 12 → x = 14. Проверка: 14 − 5 + 3 = 12 ✓",
      "tags": ["уравнения", "текстовые-задачи"],
      "difficulty": 3
    },
    {
      "id": 18,
      "text": "Реши уравнение: 4x ÷ 2 + 1 = 9",
      "options": {
        "A": "x = 4",
        "B": "x = 8",
        "C": "x = 5",
        "D": "x = 3"
      },
      "correct": "A",
      "explanation": "Упрощаем: 2x + 1 = 9 → 2x = 8 → x = 4. Проверка: 4×4÷2 + 1 = 8 + 1 = 9 ✓",
      "tags": ["уравнения", "дроби"],
      "difficulty": 2
    },
    {
      "id": 19,
      "text": "Является ли x = 3 решением уравнения 2x + 5 = 11?",
      "options": {
        "A": "Нет, левая часть даёт 10",
        "B": "Нет, левая часть даёт 12",
        "C": "Да, 2×3 + 5 = 11",
        "D": "Нет, правильный ответ x = 4"
      },
      "correct": "C",
      "explanation": "Подставляем: 2×3 + 5 = 6 + 5 = 11. Левая часть равна правой → x = 3 является решением.",
      "tags": ["уравнения", "проверка-решения"],
      "difficulty": 1
    },
    {
      "id": 20,
      "text": "Реши уравнение: 8x − 3x + 2 = 27",
      "options": {
        "A": "x = 7",
        "B": "x = 3",
        "C": "x = 6",
        "D": "x = 5"
      },
      "correct": "D",
      "explanation": "Приводим подобные: 5x + 2 = 27 → 5x = 25 → x = 5. Проверка: 8×5 − 3×5 + 2 = 40 − 15 + 2 = 27 ✓",
      "tags": ["уравнения", "алгебра"],
      "difficulty": 2
    }
  ]
}
