{
  "topic": "Логика",
  "title": "Числовые закономерности",
  "difficulty": 2,
  "tags": ["логика-последовательности", "закономерности"],
  "intro_text": "## Числовые закономерности — краткая теория\n\nЗакономерность — это **правило**, по которому строится последовательность чисел.\n\n### Шаги для нахождения правила\n1. Найди **разность** соседних чисел (a₂ − a₁, a₃ − a₂ …)\n2. Найди **частное** соседних чисел (a₂ ÷ a₁ …)\n3. Посмотри на **степени** или **произведения**\n4. Проверь правило на **всех** элементах ряда\n\n### Типы закономерностей\n\n| Тип | Пример | Правило |\n|-----|--------|---------|\n| Арифметическая | 3, 7, 11, 15 | +4 каждый раз |\n| Геометрическая | 2, 6, 18, 54 | ×3 каждый раз |\n| Квадраты | 1, 4, 9, 16, 25 | 1², 2², 3², 4², 5² |\n| Кубы | 1, 8, 27, 64 | 1³, 2³, 3³, 4³ |\n| Треугольные | 1, 3, 6, 10, 15 | +1, +2, +3, +4, +5 |\n| Фибоначчи | 1, 1, 2, 3, 5, 8 | каждое = сумма двух предыдущих |\n\n### Как найти пропущенное число\n```\nРяд: 4, 8, __, 16, 20\nРазности: 4, ?, 4, 4  → правило +4\nПропущенное: 8 + 4 = 12\n```\n\n> **Совет:** Если разности не равны, найди разности разностей — они могут быть постоянными.",
  "questions": [
    {
      "id": 1,
      "text": "Продолжи ряд: 2, 5, 8, 11, __",
      "options": {
        "A": "14",
        "B": "13",
        "C": "15",
        "D": "12"
      },
      "correct": "A",
      "explanation": "Разность между соседними элементами: 5−2=3, 8−5=3, 11−8=3. Правило: +3. Следующее: 11+3=14.",
      "tags": ["логика-последовательности", "арифметическая-прогрессия"],
      "difficulty": 1
    },
    {
      "id": 2,
      "text": "Продолжи ряд: 3, 6, 12, 24, __",
      "options": {
        "A": "36",
        "B": "27",
        "C": "48",
        "D": "42"
      },
      "correct": "C",
      "explanation": "Частное: 6÷3=2, 12÷6=2, 24÷12=2. Правило: ×2. Следующее: 24×2=48.",
      "tags": ["логика-последовательности", "геометрическая-прогрессия"],
      "difficulty": 1
    },
    {
      "id": 3,
      "text": "Продолжи ряд: 1, 4, 9, 16, __",
      "options": {
        "A": "20",
        "B": "25",
        "C": "23",
        "D": "18"
      },
      "correct": "B",
      "explanation": "Это квадраты натуральных чисел: 1²=1, 2²=4, 3²=9, 4²=16, 5²=25.",
      "tags": ["логика-последовательности", "степени"],
      "difficulty": 2
    },
    {
      "id": 4,
      "text": "Продолжи ряд: 100, 91, 82, 73, __",
      "options": {
        "A": "63",
        "B": "65",
        "C": "62",
        "D": "64"
      },
      "correct": "D",
      "explanation": "Разность: 91−100=−9, 82−91=−9, 73−82=−9. Правило: −9. Следующее: 73−9=64.",
      "tags": ["логика-последовательности", "арифметическая-прогрессия"],
      "difficulty": 1
    },
    {
      "id": 5,
      "text": "Это ряд Фибоначчи: 1, 1, 2, 3, 5, 8, __. Какое следующее число?",
      "options": {
        "A": "13",
        "B": "11",
        "C": "14",
        "D": "10"
      },
      "correct": "A",
      "explanation": "Каждое число = сумма двух предыдущих: 5+8=13. Правило: aₙ = aₙ₋₁ + aₙ₋₂.",
      "tags": ["логика-последовательности", "фибоначчи"],
      "difficulty": 2
    },
    {
      "id": 6,
      "text": "Найди пропущенное число: 2, __, 8, 11, 14",
      "options": {
        "A": "4",
        "B": "6",
        "C": "5",
        "D": "7"
      },
      "correct": "C",
      "explanation": "Разности: 8−?=3 и 11−8=3 и 14−11=3. Правило: +3. Пропущенное: 2+3=5.",
      "tags": ["логика-последовательности", "арифметическая-прогрессия"],
      "difficulty": 2
    },
    {
      "id": 7,
      "text": "Какое правило описывает ряд: 2, 6, 18, 54?",
      "options": {
        "A": "каждый раз +4",
        "B": "каждый раз ×2",
        "C": "каждый раз +12",
        "D": "каждый раз ×3"
      },
      "correct": "D",
      "explanation": "6÷2=3, 18÷6=3, 54÷18=3. Каждый элемент умножается на 3.",
      "tags": ["логика-последовательности", "геометрическая-прогрессия"],
      "difficulty": 1
    },
    {
      "id": 8,
      "text": "Продолжи ряд: 10, 8, 6, 4, __",
      "options": {
        "A": "2",
        "B": "1",
        "C": "3",
        "D": "0"
      },
      "correct": "A",
      "explanation": "Правило: −2 каждый раз. 4−2=2.",
      "tags": ["логика-последовательности", "арифметическая-прогрессия"],
      "difficulty": 1
    },
    {
      "id": 9,
      "text": "Найди пропущенное число: 1, 3, __, 7, 9",
      "options": {
        "A": "4",
        "B": "5",
        "C": "6",
        "D": "8"
      },
      "correct": "B",
      "explanation": "Разности: 3−1=2, 7−?=2, 9−7=2. Правило: +2. Пропущенное: 3+2=5.",
      "tags": ["логика-последовательности", "арифметическая-прогрессия"],
      "difficulty": 1
    },
    {
      "id": 10,
      "text": "Продолжи ряд: 3, 9, 27, __, 243",
      "options": {
        "A": "54",
        "B": "63",
        "C": "90",
        "D": "81"
      },
      "correct": "D",
      "explanation": "Правило: ×3. 9÷3=3, 27÷9=3. Пропущенное: 27×3=81. Проверка: 81×3=243 ✓",
      "tags": ["логика-последовательности", "геометрическая-прогрессия"],
      "difficulty": 2
    },
    {
      "id": 11,
      "text": "Какое число лишнее в ряду: 5, 10, 15, 21, 25?",
      "options": {
        "A": "5",
        "B": "25",
        "C": "21",
        "D": "10"
      },
      "correct": "C",
      "explanation": "Все числа кратны 5: 5, 10, 15, 25. Число 21 не делится на 5 → оно лишнее.",
      "tags": ["логика-последовательности", "закономерности"],
      "difficulty": 2
    },
    {
      "id": 12,
      "text": "Продолжи треугольные числа: 1, 3, 6, 10, __",
      "options": {
        "A": "13",
        "B": "15",
        "C": "14",
        "D": "12"
      },
      "correct": "B",
      "explanation": "Разности: +2, +3, +4. Следующая разность: +5. Ответ: 10+5=15.",
      "tags": ["логика-последовательности", "треугольные-числа"],
      "difficulty": 3
    },
    {
      "id": 13,
      "text": "Чему равен 6-й элемент ряда: 1, 4, 7, 10, 13, __?",
      "options": {
        "A": "15",
        "B": "14",
        "C": "16",
        "D": "17"
      },
      "correct": "C",
      "explanation": "Правило: +3. Элементы: 1, 4, 7, 10, 13, 16. Шестой элемент = 16.",
      "tags": ["логика-последовательности", "арифметическая-прогрессия"],
      "difficulty": 2
    },
    {
      "id": 14,
      "text": "Продолжи ряд: 50, 47, 44, 41, __",
      "options": {
        "A": "37",
        "B": "40",
        "C": "39",
        "D": "38"
      },
      "correct": "D",
      "explanation": "Правило: −3 каждый раз. 41−3=38.",
      "tags": ["логика-последовательности", "арифметическая-прогрессия"],
      "difficulty": 1
    },
    {
      "id": 15,
      "text": "Продолжи ряд: 2, 3, 5, 8, 12, __",
      "options": {
        "A": "17",
        "B": "16",
        "C": "18",
        "D": "15"
      },
      "correct": "A",
      "explanation": "Разности: +1, +2, +3, +4. Следующая разность: +5. Ответ: 12+5=17.",
      "tags": ["логика-последовательности", "разности-разностей"],
      "difficulty": 3
    },
    {
      "id": 16,
      "text": "Продолжи ряд кубов: 1, 8, 27, 64, __",
      "options": {
        "A": "100",
        "B": "144",
        "C": "125",
        "D": "81"
      },
      "correct": "C",
      "explanation": "Это кубы натуральных чисел: 1³=1, 2³=8, 3³=27, 4³=64, 5³=125.",
      "tags": ["логика-последовательности", "степени"],
      "difficulty": 3
    },
    {
      "id": 17,
      "text": "В ряду 3, 6, 9, 12, ... чему равен 8-й элемент?",
      "options": {
        "A": "18",
        "B": "21",
        "C": "27",
        "D": "24"
      },
      "correct": "D",
      "explanation": "Правило: кратные 3. n-й элемент = 3n. Восьмой: 3×8=24.",
      "tags": ["логика-последовательности", "арифметическая-прогрессия"],
      "difficulty": 2
    },
    {
      "id": 18,
      "text": "Найди пропущенное число: 3, 6, __, 24, 48",
      "options": {
        "A": "10",
        "B": "18",
        "C": "12",
        "D": "16"
      },
      "correct": "C",
      "explanation": "Правило: ×2. 3, 6, 12, 24, 48. Пропущенное: 6×2=12. Проверка: 12×2=24 ✓",
      "tags": ["логика-последовательности", "геометрическая-прогрессия"],
      "difficulty": 2
    },
    {
      "id": 19,
      "text": "Чередующийся ряд: 1, 3, 2, 4, 3, 5, 4, __. Что дальше?",
      "options": {
        "A": "5",
        "B": "7",
        "C": "6",
        "D": "8"
      },
      "correct": "C",
      "explanation": "Два чередующихся ряда: нечётные позиции (1,2,3,4…) и чётные (3,4,5,6…). Следующее — 8-я позиция: чётный ряд → 6.",
      "tags": ["логика-последовательности", "чередование"],
      "difficulty": 4
    },
    {
      "id": 20,
      "text": "Ряд: 2, 4, 8, 14, 22, __. Найди следующее число.",
      "options": {
        "A": "28",
        "B": "30",
        "C": "34",
        "D": "32"
      },
      "correct": "D",
      "explanation": "Разности: +2, +4, +6, +8. Следующая разность: +10. Ответ: 22+10=32. (Разности образуют свою арифметическую прогрессию +2.)",
      "tags": ["логика-последовательности", "разности-разностей"],
      "difficulty": 4
    }
  ]
}
